{
  "$comment": "SPDX-License-Identifier: Apache-2.0. Synthetic conformance fixture: no real property, person or record. A hook carrying a reference and a summary, and nothing else.",
  "hookId": "hk_EXAMPLE0001",
  "event": "pack.component_completed",
  "occurredAt": "2026-09-18T14:02:00Z",
  "recordRef": "rec_EXAMPLE0001",
  "subscriberId": "sub_EXAMPLE0001",
  "scope": "pack.summary",
  "payload": {
    "component": "leasehold-terms",
    "verificationLevel": "professionallyVerified",
    "readinessDelta": {
      "from": 0.62,
      "to": 0.71
    }
  },
  "deliveryAttempts": 1,
  "signature": "sha256=0000000000000000000000000000000000000000000000000000000000000000"
}
